{
  "$schema": "configs/platform/site-spec-v2.schema.json",
  "schema_version": "2.0.0",
  "identity": {
    "site_id": "seogu_gwangju",
    "legacy_ids": [],
    "display": {
      "default_label": "광주광역시 서구청",
      "locale_labels": {
        "ko": "광주광역시 서구청"
      }
    }
  },
  "domains": {
    "public": [
      "www.seogu.gwangju.kr",
      "seogu.gwangju.kr"
    ]
  },
  "entry_points": [
    {
      "id": "homepage",
      "kind": "homepage",
      "url": "https://www.seogu.gwangju.kr/"
    }
  ],
  "archetype": {
    "id": "municipality",
    "state": "review_required",
    "confidence": 0.6,
    "evidence_refs": [
      "configs/sites/seogu_gwangju.yml"
    ]
  },
  "capabilities": [
    {
      "id": "notice_board",
      "state": "detected",
      "confidence": 0.85,
      "safety_level": "navigate",
      "entry_points": [
        "homepage"
      ],
      "evidence_refs": [
        "configs/sites/seogu_gwangju.yml"
      ]
    },
    {
      "id": "document_library",
      "state": "detected",
      "confidence": 0.8,
      "safety_level": "navigate",
      "entry_points": [
        "homepage"
      ],
      "evidence_refs": [
        "configs/sites/seogu_gwangju.yml"
      ]
    },
    {
      "id": "directory",
      "state": "review_required",
      "confidence": 0.3,
      "safety_level": "read_only",
      "entry_points": [
        "homepage"
      ],
      "evidence_refs": [
        "configs/sites/seogu_gwangju.yml"
      ]
    }
  ],
  "capture_policy": {
    "acquisition_mode": "offline_fixture",
    "live_network_authorized": false
  },
  "browser_policy": {
    "surface_mode": "generated_preview",
    "actual_site_control_authorized": false
  },
  "knowledge_policy": {
    "grounding_required": true,
    "provenance_required": true
  },
  "action_policy": {
    "external_write_authorized": false,
    "high_risk_actions_authorized": false
  },
  "provenance": {
    "source_refs": [
      "configs/sites/seogu_gwangju.yml"
    ],
    "review_state": "synthetic"
  },
  "extensions": {}
}
