{
  "$schema": "configs/platform/site-spec-v2.schema.json",
  "schema_version": "2.0.0",
  "identity": {
    "site_id": "municipality_synthetic",
    "legacy_ids": [],
    "display": {
      "default_label": "Example Municipality",
      "locale_labels": {
        "ko": "예시 지자체",
        "en": "Example Municipality"
      }
    }
  },
  "domains": {
    "public": ["municipality.example.go.kr"]
  },
  "entry_points": [
    {
      "id": "ep_home",
      "kind": "homepage",
      "url": "https://municipality.example.go.kr/"
    },
    {
      "id": "ep_notice",
      "kind": "notice",
      "url": "https://municipality.example.go.kr/notice"
    },
    {
      "id": "ep_doc",
      "kind": "document",
      "url": "https://municipality.example.go.kr/docs"
    },
    {
      "id": "ep_inquiry",
      "kind": "service",
      "url": "https://municipality.example.go.kr/service"
    }
  ],
  "archetype": {
    "id": "municipality",
    "state": "configured",
    "confidence": 1.0,
    "evidence_refs": ["configs/platform/site-spec-v2.schema.json"]
  },
  "capabilities": [
    {
      "id": "site_search",
      "state": "configured",
      "confidence": 0.9,
      "safety_level": "read_only",
      "entry_points": ["ep_home"],
      "evidence_refs": ["ep_home"]
    },
    {
      "id": "notice_board",
      "state": "configured",
      "confidence": 0.9,
      "safety_level": "navigate",
      "entry_points": ["ep_notice"],
      "evidence_refs": ["ep_notice"]
    },
    {
      "id": "document_library",
      "state": "configured",
      "confidence": 0.85,
      "safety_level": "navigate",
      "entry_points": ["ep_doc"],
      "evidence_refs": ["ep_doc"]
    },
    {
      "id": "service_catalog",
      "state": "detected",
      "confidence": 0.7,
      "safety_level": "navigate",
      "entry_points": ["ep_inquiry"],
      "evidence_refs": ["ep_inquiry"]
    },
    {
      "id": "contact",
      "state": "configured",
      "confidence": 0.8,
      "safety_level": "read_only",
      "entry_points": ["ep_home"],
      "evidence_refs": ["ep_home"]
    }
  ],
  "capture_policy": {
    "acquisition_mode": "synthetic",
    "live_network_authorized": false
  },
  "browser_policy": {
    "surface_mode": "generated_preview",
    "actual_site_control_authorized": false
  },
  "knowledge_policy": {
    "grounding_required": true,
    "provenance_required": true
  },
  "action_policy": {
    "external_write_authorized": false,
    "high_risk_actions_authorized": false
  },
  "provenance": {
    "source_refs": ["tests/fixtures/platform/site-spec-v2/municipality.json"],
    "review_state": "synthetic"
  },
  "extensions": {
    "municipality": {
      "jurisdiction": {
        "canonical_name": "Example Municipality",
        "short_name": "Example",
        "effective_from": "2026-01-01",
        "historical_aliases": []
      }
    }
  }
}
